blind blond cross road ; follow seeing-ey chicken .
one-hand man cross road ; get second hand shop .
monkey cross road ; could get spank .
turkey cross road ; chicken .
fat turkey cross road ; get hit car .
georg bush cross road ; ask dad run presid .
gum cross road ; beacaus stuck chicken foot .
woman cross road ; know get shoe kitchen .
chicken cross road ; thought egg-cel idea .
dinosaur cross road ; chicken around yet .
cow cross road ; chicken holiday .
chicken cross playground ; get slide .
dog cross road twice ; tri fetch boomerang .
fish cross ocean ; get tide .
spider cross road ; get web site .
fish cross road ; get school .
cow cross road ; get udder side .
dog cross road ; chase chicken .
duck cross road ; thought chicken .
cactu cross road ; stuck chicken back .
rooster cross road ; prove chicken .
skeleton cross road ; gut .
sheep cross road ; get baa baa shop haircut .
chicken cross road ; get tire stand .
turtl cross road ; get shell station .
chicken stop cross road ; got tire everyon make mani joke .
call boomerang wo come back ; stick .
call clairvoy midget broke prison ; small medium larg .
best thing alzheim diseas ; hide easter egg .
differ ; 3 inch .
know blond send e-mail ; see bunch envelop stuf disk drive .
women pay attent appear improv mind ; men stupid blind .
call group blond roller skate ; mobil sperm bank .
tell male chromosom femal chromosom ; pull gene .
breast martini common ; one enough three mani .
call row rabbit jump backward ; reced hair line .
call song sung automobil ; cartoon .
call fish eye ; fsh .
call deer eye ; eye deer .
make hot dog stand ; steal chair .
hold without ever touch ; convers .
cloth hous wear ; address .
countri make shiver ; chile .
get cross stream brook ; wet feet .
get cross poison ivi clover ; rash good luck .
lot key open door ; piano .
mother broom say babi broom ; time go sweep .
neckti say hat ; go ahead hang around .
rug say floor ; move got cover .
doughnut shop close ; owner got tire w hole busi .
call countri everyon drive red car ; red carnat .
round bad-temp ; viciou circl .
get cross stream brook ; wet feet .
happen frog park illeg ; get toad .
call pig karat ; pork chop .
call song sung automobil ; cartoon .
chair break ; call chairman .
get cross chicken cement mixer ; brick layer .
differ simba oj simpson ; one african lion lion african .
differ princess diana tiger wood ; tiger wood better driver .
ca smoke weed iraq ; piec middl east .
question marri men die wive ; answer want .
question diaper politician common ; answer need chang regularli exactli reason .
question definit earli even news ; answer start word good even spend next half hour telll one .
question devic find furnitur poorli lit room everi time ; answer shinbon .
question parent give children middl name ; answer child know serious troubl .
question anoth name femal viagra ; answer diamond .
question cowboy say went went car showroom germani ; answer audi .
question quickest way speed 70 year old husband heart rate ; answer tell pregnant .
question best way avoid wrinkl age ; answer remov spectacl .
question three letter alter boy men girl women ; answer age .
question fish easi weigh ; answer scale .
question know fli frill airlin ; answer need correct chang board plane .
question frill airlin never show movi flight ; answer need keep see life flash eye .
question turkey side would find feather ; answer outsid .
question cat dislik fli saucer ; answer imposs reach milk .
question cat nine live ; answer frog croak everi day .
question ballet pig like best ; answer swine lake .
question big differ chop pork pea soup ; answer everybodi chop pork everyon ca pea soup .
question eat clown ; answer tast funni .
question saw two cowboy kitchen would real one ; answer one stood rang .
question would find dog one leg ; answer exactli left .
question room pack marri peopl seem empti ; answer singl person .
question differ pessimist magnet ; answer magnet posit side .
question longest sentenc man know ; answer .
question call chicken cross road ; answer poultri motion .
question quicker way transfer money electron bank ; answer marriag .
question would cross panther beef burger ; answer realli fast food .
question would cross pig karat expert ; answer pork chop .
question traffic light rare go swim ; answer take much long chang .
question thiev shower commit crime ; answer like clean getaway .
question type bow never tie ; answer rainbow .
question jack take prune even ; answer could get date .
question could pirat play poker ; answer sat deck .
question loudest state ; answer illi nois .
question bird fli southward winter ; answer much far walk .
question unpleas eat meal next group basketbal player ; answer dribbl far much .
question mani teacher would take find way maze ; answer idea none ever made yet .
question obtain virgin wool ; answer realli ugli sheep .
question trebl valu skoda car ; answer put gallon petrol .
question best definit mix emot ; answer watch mother-in-law revers cliff drive brand new car .
question cow leg call ; answer ground beef .
question divorc cost much ; answer worth .
question would 65 year old man find young attract woman would take interest ; answer local bookshop section mark fiction .
question good use valet park get older ; answer rememb car park .
question take six men eight hour wall built long would three men take build ; answer would take time alreadi built .
question would four peach three pear one hand four pear three peach ; answer incred larg hand .
question would lift giraff one hand ; answer matter wo find one hand giraff .
question green stone thrown sea becom ; answer wet question fall regularli although never get hurt answer rain question rout crazi peopl take go wood answer follow psycho path question would spoilt littl rich girl chang light bulb answer would ask daddi buy new apart question peopl prison use commun one anoth answer cell phone question would happen cross two snowmen three vampir answer would get sever frostbit question big fuzzi green four leg six pocket fall tree would probabl kill answer snooker tabl question lettuc serv salad bar titan answer iceberg question shake twitch found sea bottom answer nervou wreck question mani peopl surnam jone telephon book answer got phone question peopl alway walk whenev play bagpip answer even attempt get away aw nois question happen man lost left arm left leg eye accid answer touch go right question name person made king arthur round tabl answer sir cumfer call rabbit hop revers simpl call reced hare-lin hairlin call old snowman water coat alway wet put obvious coat paint curiou letter word consist six letter take away last twelv remain word word dozen kind song lion sing christma time jungl bell jingl bell boat like pile snow adrift snowmen get around icicl basebal player hold water pitcher basebal player alway contact one anoth must touch base often skeleton cross road gut pumpkin pi pie get divid circumfer pumpkin diamet ghost like rain dampen spirit call dinosaur texa tyrannosauru tex rex call dinosaur wreck everyth tyrannosauru wreck rex make hot dog stand steal chair make egg laugh tell yolk joke prevent summer cold catch winter pig go hospit obvious hambul bird lift crane hold without ever touch convers kind cloth hous wear ad-dress countri make shiver chile one magnet infatu magnet obvious attract delawar dela wear new jersey mother broom say babi broom time go sweep sleep rug say floor move got cover call person born usa grow uk die japan dead easter bunni shini nose powder puff wrong end teacher eye cross could control pupil call song sung automobil cartoon car tune call best butter farm goat call chair crack call chairman get cross easter bunni bug get bug bunni get cross stream brook wet feet frog becom toad frog park illeg get toad tow mani key unabl pen lock piano tree favorit drink root beer find gorilla bed tri sleep elsewher without wake gorilla kind tie ca wear railroad tie lie back one hundr feet air dead centiped tell vampir like basebal everi night turn bat would countri call everyon live car in-car-n presidenti seal gray anim eat fish live washington farmer take pig sunday morn holiday took pignic picnic nightclub fortunetel call crystal ball mummi friend much wrap graveyard alway noisi full sick peopl coffin coughin one elev say believ come someth subject witch top school spell made doughnut owner wind busi mainli got tire hole busi w-hole tallest build transylvania call natur vampir state build kind cat like go bowl alley obvious alley cat nosey pepper get jalapeno busi call fake noodl impasta call allig vest investig happen eat yeast shoe polish everi morn rise shine differ guitar fish .
call pile kitten ; meowntain .
call babi monkey ; chimp old block .
hear race lettuc tomato ; lettuc head tomato tri ketchup .
hear hungri clock ; went back four second .
call boy final stood bulli ; ambul .
ca give elsa balloon ; let go .
get pamper cow ; spoil milk .
mississippi bought virginia new jersey would delawar ; idaho alaska .
hear new broom ; sweep nation .
call eleph matter ; irreleph .
lawyer wear court ; lawsuit .
get wetter dri ; towel .
crayon go vacat ; color-ado .
belt get arrest ; held pair pant .
call fat psychic ; four chin teller .
call comput float ocean ; dell roll deep .
bacon say tomato ; lettuc get togeth .
call comput sing ; a-del .
hear shampoo shortag jamaica ; dread-ful .
call cat win dog show ; cat-has-trophi .
make tissu danc ; put littl boogey .
heavi forward backward ; ton .
call gangsta snowman ; froze-t .
femur say patella ; kneed .
get cross cat dark hors ; kitti perri .
pictur go jail ; frame .
call three-foot aardvark ; yardvark .
get cross fish eleph ; swim trunk .
bee go bathroom ; bp station .
earn live drive custom away ; taxi driver .
call laugh jar mayonnais ; lmayo .
call dinosaur extens vocabulari ; thesauru .
shoot killer bee ; bee bee gun .
drown hipster ; mainstream .
kind joke make shower ; clean joke .
babi corn say mama corn ; popcorn .
make holi water ; boil hell .
happen dog swallow firefli ; bark de-light .
stay corner travel world ; stamp .
call man bodi nose ; nobodi nose .
comput go doctor ; viru .
giraff get bad grade ; head cloud .
frog happi ; eat whatev bug .
brown head tail leg ; penni .
make octupu laugh ; ten-tickl .
pirat call pirat ; caus arrrrr .
tallest build world ; librari stori .
first bet peopl make live ; alpha bet .
get cross cow duck ; milk quacker .
organ space parti ; planet .
leopard say eat owner ; man hit spot .
call sleep bull ; bulldoz .
call secur guard work outsid samsung shop ; guardian galaxi .
call grandma speed dial ; instagram .
banana go doctor ; peel well .
england wettest countri ; queen reign year .
belong other use ; name .
fish live salt water ; pepper make sneez .
man put money freezer ; want cold hard cash .
get cross snowman vampir ; frostbit .
best day go beach ; sunday cours .
build largest ; librari stori .
call illeg park frog ; toad .
bow ca tie ; rainbow .
call laugh motorcycl ; yamahahaha .
season trampolin ; spring time .
comput go danc ; disc-o .
one head one foot four leg ; bed .
differ school teacher train ; teacher say spit gum train say chew chew chew .
birdi go hospit ; get tweetment .
cross-ey teacher lose job ; could control pupil .
call someon afraid santa ; clausterphob .
three candi find everi school ; nerd dumdum smarti .
sound porcupin make kiss ; ouch .
guy look fast food friend ; friend said dinner .
hear joke roof ; never mind head .
call bee live america ; usb .
make tissu danc ; put bogey .
skeleton go danc ; no-bodi go .
crazi peopl go forest ; take psycho path .
hear angri pancak ; flip .
prison use call ; cell phone .
call cow twitch ; beef jerki .
ever hear movi constip ; never came .
call bear teeth ; gummi bear .
get cross sonic hedgehog curiou georg ; 2 fast 2 curiou .
hear hairdress ; dy .
call musician problem ; trebl man .
hear italian chef die ; pasta way .
snowmen keep money ; snow bank .
call religi person sleep walk ; roman cathol .
hear crab went seafood disco ; pull muscl .
hear carrot detect ; got root everi case .
ca take nap race ; snooz loos .
tie say hat ; go ahead hang around .
wash small beach ; microwav .
never ask question receiv lot answer ; telephon .
goe town hill move ; road .
hear guy got hit head soda ; lucki soft drink .
thunder lightn lab ; scientist brainstorm .
delawar ; new jersey .
toni go prune ; could find date .
cal purpl mean ; violent .
littl mountain say big mountain ; hi cliff .
hear one geologist ; took wife granit left .
winni pooh say agent ; show honey .
man say wall ; one crack like plaster ya .
get cross fridg radio ; cool music .
could pirat play card ; sit deck .
differ bird flu swine flu ; bird flu need tweetment swine flu need oink-ment .
traffic light turn red ; would chang middl street .
one elev say elev ; think come someth .
call window rap ; 2panez .
happen faucet tomato lettuc race ; lettuc ahead faucet run tomato tri ketchup .
ca nose 12 inch long ; would foot .
four wheel fli ; garbag truck .
start p end e million letter ; post offic .
call belt watch ; waist time .
blanket say bed ; worri got cover .
take pencil bed ; draw curtain .
call unpredict control photograph ; loos canon .
call frozen dog ; pupsicl .
lone ranger say take garbag ; dump dump dump dump dump .
mani book put empti backpack ; one empti .
kind button wo unbutton ; bellybutton .
call 80 synth pop band scoop ice cream ; depech la mode .
call group men wait haircut ; barbercu .
sea-gul fli sea ; flew bay would bagel .
dog keep best time ; watch dog .
call condiment hit singl ; must heard .
call two fat peopl chat ; heavi discuss .
tomato turn red ; saw salad dress .
get plant kiss ; tu-lip two-lip .
daddi chimney say babi chimney ; littl smoke .
call ghost mom dad ; transpar .
god make one yogi bear ; tri make second one made boo-boo .
grape got step ; let littl wine .
call new girl bank ; nutella .
judg say skunk walk court room ; odor court .
fish say swam wall ; dam .
skeleton fight ; gut .
call chees ; nacho chees .
street ghost haunt ; dead end .
hear astronaut step chew gum ; got stuck orbit .
penni say penni ; make perfect cent .
man one hand cross road ; get second hand shop .
boy sprinkl sugar pillow went sleep ; could sweet dream .
call nervou javelin thrower ; shakespear .
hear painter hospit ; report say due mani stroke .
robber take bath ; want make clean getaway .
happen life give melon ; dyslex .
judg say dentist ; swear pull tooth whole tooth noth tooth .
boy tipto past medicin cabinet ; want wake sleep pill .
call funni mountain ; hill-ari .
goe rain come ; umbrella .
belt go jail ; held pair pant .
hear calendar thief ; got 12 month say day number .
happen life give melon ; dyslex .
one raindrop say ; two compani three cloud .
balloon burst ; saw lolli pop .
hear sick juggler ; say couldnt stop throw .
kind driver never get park ticket ; screw driver .
stamp say envelop ; stick go place .
shave 10 time day still beard ; barber .
call hors ca lose race ; sherbet .
call dentist armi ; drill sergeant .
triangl say circl ; pointless .
hear new johnni depp movi ; one rate arrrr .
milk stool 3 leg ; cow utter .
easi get hard get ; troubl .
hear guy die axe fell ; polic call axe-i-d .
dinosaur cross road ; chicken joke invent yet .
kind light noah use ark ; flood light .
hear monster five leg ; trouser fit like glove .
see giraff elementari school ; high school .
longest word dictionari ; smile mile s .
happen wooden car wooden wheel wooden engin ; wooden go .
month soldier hate ; month march .
painter say wall ; one crack like plaster .
call bee bad hair day ; frisbe .
go colleg ; want smarti .
stay ground never get dirti ; shadow .
kind short cloud wear ; thunderwear .
golfer wear two pair pant ; case get hole one .
kind berri color book ; crayon-berri .
call magician plane ; fli sorcer .
toilet paper roll hill ; want get bottom .
clean bottom ocean ; mer-maid .
when best time go dentist ; tooth-hurti .
one aspir wig say aspir wig ; wan na get head .
hear paddl sale boat store ; quit oar deal .
goofi put clock desk ; want work over-tim .
know diarrhea hereditari ; run jean .
would stole kiss ; call polic .
call south american girl alway hurri ; urgent tina .
johnni throw clock window ; want see time fli .
stop green go red ; eat watermelon .
tailor think new job ; sew sew .
farmer mend pant ; cabbag patch .
man lose job orang juic factori ; could concentr .
tell joke paper ; nah never mind tearabl .
repair broken tomato ; tomato past .
babi strawberri cri ; parent jam .
hamburg name daughter ; patti .
kind egg bad chicken lay ; devil egg .
kind key open door thanksgiv ; turkey .
cooki go hospit ; felt crummi .
teacher eye cross ; could control pupil .
call guy never fart public ; privat tutor .
call bear sock ; bare-foot .
serv never eat ; volleybal .
kind shoe spi wear ; sneaker .
soccer player bring string game ; could tie score .
basebal team similar muffin ; depend batter .
alien say garden ; take weeder .
call two fat peopl chat ; heavi discuss .
hear two bed bug met mattress ; got marri spring .
watermelon fanci wed ; cantaloup .
heard joke butter ; better tell might spread .
basebal player stay cool ; sit next fan .
math book sad ; mani problem .
run get anywher ; refriger .
astronaut favorit place comput ; space bar .
robot mad ; peopl kept push button .
exam young witch pass ; spell- test .
call sheep head leg ; cloud .
boy eat homework ; teacher said piec cake .
basketbal messi sport ; dribbl floor .
commun fish ; drop line .
digit watch say grandfath ; look grandpa hand .
sheep go get haircut ; baa baa shop .
shark like eat peanut butter ; jellyfish .
cat eat breakfast ; mice crispi .
ca leopard hide ; alway spot .
give dog fever ; mustard best thing hot dog .
get cross cat lemon ; sour puss .
kind flower sleep night ; day-zzz .
bird fli south winter ; easier walk .
kind key open banana ; monkey .
hear vampir bicycl went round bite peopl arm ; viciou cycl .
know carrot good eyesight ; ever seen rabbit wear glass .
hummingbird hum ; know word .
one plate say ; dinner .
fish bottom ocean ; drop school .
goe move ; temperatur .
weigh ton feather ton brick ; neither weigh ton .
hear blond gave cat bath ; still gotten hair tongu .
one horn give milk ; milk truck .
bull get messag ; bull-etin board .
bull go shop ; charg .
call hous like food ; condoment .
run ca walk ; faucet .
kind bed mermaid sleep ; water bed .
kind cracker firemen like soup ; firecrack .
barber win race ; took short cut .
boat go get sick ; dock .
call leftov alien ; extra terrestri .
taken get ; pictur .
what differ roast beef pea soup ; roast beef cant pea soup .
concert cost 45 cent ; 50 cent featur nickleback .
februari march ; april may .
hear injur veget ; say got beet .
tree go dentist ; get root canal .
call cat win dog show ; cat-has-trophi .
broom late ; swept .
2016 calendar popular 2015 calendar ; date .
caus airlin go bankrupt ; runway inflat .
call snowman six pack ; abdomin snowman .
hear joke germ ; never mind want spread around .
call person chop cereal ; cereal killer .
call crush angl ; rectangl .
fish alway know much weigh ; scale .
11 year old go pirat movi ; rate arrrrr .
janitor say jump closet ; suppli .
tie say hat ; go ahead hang around .
hear limo driver went 25 year without custom ; time noth chauffeur .
scarecrow win nobel prize ; outstand field .
pet make loudest nois ; trum-pet .
hear kidnap ; woke .
differ calendar ; calendar date .
call rabbit flea ; bug bunni .
word look backward upsid ; swim .
manag hire marsupi ; koala-fi .
